link,title,snippet,date,source,sentiment,sentiment_score
https://thesmartinvestor.com.sg/4-singapore-reits-that-can-supply-you-with-dividends-for-life/,4 Singapore REITs That Can Supply You with Dividends for Life,We shine the spotlight on four attractive Singapore REITs that can supply you with a lifetime of passive income.,2025-01-20,The Smart Investor,neutral,0.919197678565979
https://www.businesstimes.com.sg/companies-markets/maybank-initiates-parkway-life-reit-coverage-buy-call-s4-10-price-target-strong-growth-prospects,"Maybank initiates Parkway Life Reit coverage with ‘buy’ call, S$4.10 price target, on strong growth prospects","Maybank initiates Parkway Life Reit coverage with 'buy' call, S$4.10 price target, on strong growth prospects · OCBC says healthcare S-Reits...",2025-01-09,The Business Times,positive,0.9172616004943848
https://drwealth.com/parkway-life-reit-buys-nursing-homes-in-france-good-or-bad/,"Parkway Life REIT Buys Nursing Homes in France, Good or Bad?","While it's true that staying just at its comfort zone means lesser risks and concerns, PLife REIT could easily underperform against other stocks...",2024-10-24,Dr Wealth,neutral,0.8845150470733643
https://www.theedgesingapore.com/capital/results/parkway-life-reit-2hfy2024-dpu-dips-13-y-o-y-738-cents,Parkway Life REIT 2HFY2024 DPU dips 1.3% y-o-y to 7.38 cents,Parkway Life REIT 2HFY2024 DPU dips 1.3% y-o-y to 7.38 cents ... Follow us on Facebook and join our Telegram channel for the latest updates.,2025-02-19,The Edge Singapore,negative,0.9651188254356384
https://sbr.com.sg/markets-investing/news/parkway-life-reit-raises-180m-in-oversubscribed-private-placement,Parkway Life REIT raises $180m in oversubscribed private placement,The REIT will issue 47.4m new units at $3.80 apiece. It expects to raise gross proceeds of $180.0m from the private placement.,2024-10-23,Singapore Business Review,positive,0.7255045175552368
https://www.mingtiandi.com/real-estate/outbound-investment/parkway-life-reit-buying-11-french-nursing-homes-for-120m/,Singapore’s Parkway Life REIT Buying 11 French Nursing Homes for $120M,Healthcare-focused PLife REIT is buying the properties from operator DomusVi Group and will lease them back to the French company for 12 years...,2024-10-23,Mingtiandi,neutral,0.8212191462516785
https://www.businesstimes.com.sg/companies-markets/reits-property/parkway-life-reit-posts-2-8-higher-q3-dpu-s0-1130,Parkway Life Reit posts 2.8% higher Q3 DPU of S$0.113,"Parkway Life Reit H1 2024 DPU rises 3.5% despite fall in net property income. Units of Parkway Life Reit closed flat at S$4.02 on Wednesday,...",2024-10-16,The Business Times,positive,0.9415289759635925
https://thesmartinvestor.com.sg/top-stock-market-highlights-of-the-week-parkway-life-reit-mcdonalds-and-tesla/,"Top Stock Market Highlights of the Week: Parkway Life REIT, McDonald’s and Tesla",We look at a major acquisition by a leading healthcare REIT and an electric vehicle manufacturer's last earnings report.,2024-10-26,The Smart Investor,neutral,0.8733843564987183
https://www.theedgesingapore.com/capital/brokers-calls/s-reits-dpu-bounce-back-2025-2026-parkway-life-reit-dark-horse-dbs,"S-REITs’ DPU to bounce back in 2025, 2026; Parkway Life REIT a ‘dark horse’: DBS","S-REITs will post a turnaround in distribution per unit (DPU) growth over FY2025-FY2026, at 3.4%, according to DBS Group Research.",2025-01-03,The Edge Singapore,neutral,0.6528218388557434
https://sbr.com.sg/commercial-property/news/parkway-life-reit-inches-dpu-1-in-fy-2024,Parkway Life REIT inches up DPU by 1% in FY 2024,Parkway Life Real Estate Investment Trust (PLife REIT) reported a 1% year-on-year increase in distribution per unit (DPU) to 14.92 cents for...,2025-02-19,Singapore Business Review,positive,0.9508729577064514
https://thesmartinvestor.com.sg/3-reliable-singapore-reits-yielding-4-2-and-higher-that-could-potentially-raise-their-dpus/,3 Reliable Singapore REITs Yielding 4.2% and Higher That Could Potentially Raise Their DPUs,These three REITs not only provide a decent distribution yield but are also well-positioned to raise their distributions over time.,2024-11-19,The Smart Investor,positive,0.9246712327003479
https://www.businesstimes.com.sg/companies-markets/ocbc-says-healthcare-s-reits-offer-defence-amid-slower-rate-cuts-names-top-picks,"OCBC says healthcare S-Reits offer defence amid slower rate cuts, names top picks",Analysts name Parkway Life Reit as their favourite choice for its growth potential; First Reit also gets a “buy” rating.,2025-01-06,The Business Times,positive,0.8323080539703369
https://www.theedgesingapore.com/capital/brokers-calls/ocbc-dbs-maintain-bullish-stance-parkway-life-reit,"OCBC, DBS maintain bullish stance on Parkway Life REIT","For the six months ended Dec 31 2024, PLife REIT's revenue and net property income dipped by 0.3% and 1.1% y-o-y, as revenue booked in yen...",2025-02-19,The Edge Singapore,positive,0.857708752155304
https://www.businesstimes.com.sg/companies-markets/reits-property/parkway-life-reit-h2-dpu-falls-1-3-s0-0738-enlarged-unit-base,Parkway Life Reit H2 DPU falls 1.3% to S$0.0738 on enlarged unit base,Parkway Life Reit H2 DPU falls 1.3% to S$0.0738 on enlarged unit base · Industry observers believe Singapore still has what it takes to remain...,2025-02-19,The Business Times,negative,0.9677689671516418
https://thesmartinvestor.com.sg/4-telltale-signs-that-a-reit-could-pay-you-for-life/,4 Telltale Signs That a REIT Could Pay You for Life,Dividends are a big reason why Singaporean investors invest in the stock market. Real estate investment trusts (REITs) are particularly...,2024-08-30,The Smart Investor,neutral,0.7814766764640808
https://www.theedgesingapore.com/capital/results/parkway-life-reit-3qfy2024-gross-revenue-falls-22-y-o-y-dpu-28,"Parkway Life REIT 3QFY2024 gross revenue falls 2.2% y-o-y, DPU up 2.8%","Singapore Parkway Life REIT has reported gross revenue of $108.5 million for 3QFY2024 ended Sept 30, 2.2% lower yoy.",2024-10-16,The Edge Singapore,negative,0.9569641351699829
https://www.businesstimes.com.sg/companies-markets/s-reits-announce-their-schedule-upcoming-earnings-season,S-Reits announce their schedule for upcoming earnings season,AROUND three-quarters of real estate investment trusts (Reits) and property trusts in Singapore have confirmed the release dates for their...,2024-10-20,The Business Times,neutral,0.870398223400116
https://thesmartinvestor.com.sg/better-buy-first-reit-vs-parkway-life-reit/,Better Buy: First REIT Vs Parkway Life REIT,"Reviewing the two healthcare REITs, PLife REIT is the winner as it has a longer track record of uninterrupted core DPU growth stretching all the way back to...",2024-06-07,The Smart Investor,neutral,0.8137760758399963
https://www.businesstimes.com.sg/companies-markets/parkway-life-reit-acquires-11-nursing-homes-france-111-2-million-euros,Parkway Life Reit acquires 11 nursing homes in France for 111.2 million euros,Parkway Life Reit is acquiring 11 nursing homes in France for a total consideration of about 111.2 million euros (S$159.9 million).,2024-10-22,The Business Times,neutral,0.8947961926460266
https://www.businesstimes.com.sg/companies-markets/stocks-watch-keppel-infrastructure-trust-sia-engineering-parkway-life-reit-seatrium-raffles-medical,"Stocks to watch: Keppel Infrastructure Trust, SIA Engineering, Parkway Life Reit, Seatrium, Raffles Medical",Keppel Infrastructure Trust's business trust's manager reported that revenue for the first half of 2024 fell 5.8 per cent to S$1 billion from S$1.1 billion a...,2024-07-29,The Business Times,neutral,0.9500618577003479
https://www.reitsweek.com/2025/02/cohen-steers-sells-down-stake-in-parkway-life-reit.html,Cohen & Steers sells down stake in Parkway Life REIT,"ByRachel Young ... Cohen & Steers Capital Management, Inc. has reduced its stake in Parkway Life REIT. The sell-down has brought down the firm's...",2025-02-19,reitsweek,neutral,0.8834140300750732
https://www.businesstimes.com.sg/companies-markets/reits-property/parkway-life-reit-acquires-osaka-nursing-home-property-2-4-billion-yen,Parkway Life Reit acquires Osaka nursing home property for 2.4 billion yen,"Parkway Life Reit H1 2024 DPU rises 3.5% despite fall in net property income. As at Dec 31, the Reit owns a portfolio of 63 properties across...",2024-07-31,The Business Times,neutral,0.9134959578514099
https://www.theedgesingapore.com/capital/brokers-calls/uobkh-lowers-target-price-parkway-life-reit-keeps-rosy-outlook,UOBKH lowers target price on Parkway Life REIT but keeps a rosy outlook,"UOB Kay Hian continues to rate Parkway Life REIT (PREIT) a “buy”, but with a lower target price of $4.85 from $5.12 previously, on higher cost of equity.",2025-02-19,The Edge Singapore,positive,0.5129102468490601
https://growbeansprout.com/healthcare-reits-sep-2024,Singapore Healthcare REITs: Defensive assets warrant value premium,ParkwayLife REIT (PLIFE) has always traded at premium to book. PLIFE and FIRST trade at wide disparity in terms of P/B and yield.,2024-09-22,Beansprout,neutral,0.9032917618751526
https://www.theedgesingapore.com/capital/brokers-calls/maybank-initiates-buy-parkway-life-reit-calling-it-expensive-defensive,"Maybank initiates ‘buy’ on Parkway Life REIT, calling it ‘expensive but defensive’","With this, Guha has initiated a target price of $4.10, which represents an upside of 12% to the REIT's $3.79 unit price as at his report. The...",2025-01-09,The Edge Singapore,negative,0.9075635671615601
https://www.businesstimes.com.sg/companies-markets/stocks-watch-sembcorp-parkway-life-reit-yeo-hiap-seng,"Stocks to watch: Sembcorp, Parkway Life Reit, Yeo Hiap Seng",Parkway Life Real Estate Investment Trust : C2PU -1.22% (Parkway Life Reit): Its third-quarter distribution per unit rose 2.8 per cent to S...,2024-10-17,The Business Times,neutral,0.9366840720176697
https://thesmartinvestor.com.sg/worried-about-troubles-in-the-reit-sector-these-4-singapore-reits-should-provide-peace-of-mind/,Worried About Troubles in the REIT Sector? These 4 Singapore REITs Should Provide Peace of Mind,Here are four Singapore REITs that should continue to do well and provide income investors with peace of mind.,2024-06-18,The Smart Investor,neutral,0.8137316107749939
https://www.theedgesingapore.com/capital/brokers-calls/ocbc-maintains-buy-call-upgrades-tp-parkway-life-reit,"OCBC maintains ‘buy’ call, upgrades TP on Parkway Life REIT","4 billion is 9.1% below the property's independent valuation of JPY2.7 billion as of June 30. The acquisition will be fully funded by JPY debt,...",2024-10-03,The Edge Singapore,neutral,0.841463029384613
https://www.reitsweek.com/2025/02/parkway-life-reit-achieves-another-year-of-dpu-growth-amid-europe-expansion.html,Parkway Life REIT achieves another year of DPU growth amid Europe expansion,"ByRachel Young ... Parkway Life REIT (PLife REIT) has announced its financial results for the fiscal year ending 31 December 2024 on 5 February,...",2025-02-19,reitsweek,positive,0.952124834060669
https://growbeansprout.com/weekly-market-review-21-oct-2024,Keppel DC REIT and Parkway Life REIT in focus: Weekly Review with SIAS,We discuss key developments in the global equity market and also share more about Keppel DC REIT and Parkway Life REIT.,2024-10-21,Beansprout,neutral,0.9365873336791992
https://sbr.com.sg/markets-investing/news/parkway-life-reits-npi-dips-21-in-q3-yen-depreciation,Parkway Life REIT's NPI dips 2.1% in Q3 on yen depreciation,Parkway Life REIT's NPI dips 2.1% in Q3 on yen depreciation. Its gross revenue also fell. Parkway Life REIT's net property income (NPI) dipped...,2024-10-17,Singapore Business Review,negative,0.9725635051727295
https://www.businesstimes.com.sg/companies-markets/stocks-watch-mapletree-logistics-trust-capitaland-ascott-trust-keppel-infrastructure-trust-parkway,"Stocks to watch: Mapletree Logistics Trust, CapitaLand Ascott Trust, Keppel Infrastructure Trust, Parkway Life Reit",Mapletree Logistics Trust clocked a 10.6 per cent fall in distribution per share to S$0.02027 on higher borrowing and lower China revenue.,2024-10-23,The Business Times,neutral,0.9456808567047119
https://www.businesstimes.com.sg/companies-markets/healthcare-s-reits-are-here-stay,Healthcare S-Reits are here to stay,"Healthcare real estate investment trusts (Reits) have been the best-performing Reit subsector in the year to date as at Feb 20, recording an average total...",2025-02-26,The Business Times,neutral,0.8640612959861755
https://www.tipranks.com/news/company-announcements/parkway-life-reit-announces-2024-property-valuation-results,Parkway Life REIT Announces 2024 Property Valuation Results,Parkway Life Real Estate Investment Trust (PLife REIT) is a prominent player in the healthcare real estate sector in Singapore. The company...,2025-02-19,TipRanks,neutral,0.9302123785018921
https://www.theedgesingapore.com/news/reits/parkway-life-reit-announces-first-ever-private-placement-french-acquisition,Parkway Life REIT announces first-ever private placement for French acquisition,Parkway Life REIT intends to fully finance the acquisition via an equity fund raising by way of a private placement to raise $180 million. This...,2024-10-22,The Edge Singapore,neutral,0.5985317230224609
https://www.mingtiandi.com/real-estate/finance/parkway-life-reit-adding-osaka-nursing-home-to-japan-portfolio/,Singapore’s Parkway Life REIT Adding Osaka Nursing Home to Japan Portfolio,Singapore's Parkway Life REIT Adding Osaka Nursing Home to Japan Portfolio ... Healthcare-focused Parkway Life REIT is adding to its Japan...,2024-08-01,Mingtiandi,neutral,0.792998194694519
https://www.theedgesingapore.com/capital/brokers-calls/dbs-raises-target-price-parkway-life-reit-480,DBS raises target price for Parkway Life REIT to $4.80,"The hospital is valued at around $2 billion and if and when is acquired by the REIT, will be a new growth catalyst, the DBS analysts say.",2024-11-26,The Edge Singapore,positive,0.5622034668922424
https://realassets.ipe.com/news/plife-reit-makes-european-debut-with-111m-nursing-home-purchase/10076333.article,PLife REIT makes European debut with €111m nursing home purchase,"PLife REIT has entered the European market through a €111.2m sale-leaseback transaction, acquiring 11 nursing homes in France from care home operator DomusVi.",2024-10-22,IPE Real Assets,positive,0.564932644367218
https://www.businesstimes.com.sg/companies-markets/parkway-life-reit-q1-dpu-4-s-0-0379,Parkway Life Reit Q1 DPU up 4% to S$0.0379,"Finance costs increased 4.4 per cent to S$2.6 million, from S$2.5 million, on the back of capital expenditure (capex), new acquisitions in 2023,...",2024-04-30,The Business Times,positive,0.9420246481895447
https://www.reitsweek.com/2024/10/parkway-life-reit-acquires-french-nursing-homes-for-eur111-2-million.html,Parkway Life REIT acquires French nursing homes for EUR111.2 million,ByShariffa Al-Habshee ... Parkway Life REIT (PLife REIT) has announced its strategic expansion into Europe through the acquisition of 11 nursing...,2024-10-22,reitsweek,neutral,0.9015567898750305
https://thesmartinvestor.com.sg/searching-for-resilient-reits-here-are-4-singapore-reits-to-consider-for-your-portfolio/,Searching for Resilient REITs? Here Are 4 Singapore REITs to Consider for Your Portfolio,"Though the REIT sector was beaten down this year, income investors can stick with these four resilient Singapore REITs.",2024-07-11,The Smart Investor,neutral,0.9287496209144592
https://www.theedgesingapore.com/capital/brokers-calls/citi-research-has-kept-neutral-parkway-lifes-valuations-after-acquisition-11,Citi Research has kept 'neutral' on Parkway Life's valuations after acquisition of 11 nursing homes in France,"Following Parkway Life REIT's acquisition of 11 nursing homes in France for EUR111.2 million ($159.9 million), Citi Research analyst Brandon...",2024-10-23,The Edge Singapore,neutral,0.7604809403419495
https://growbeansprout.com/reits-weekly-watch-20-oct-2024,Keppel DC REIT and Parkway Life REIT report higher dividends: REITs Weekly Watch,"Both Keppel DC REIT and ParkwayLife REIT saw a decline in their net property income, but still managed to report a slight increase in dividend per unit...",2024-10-20,Beansprout,positive,0.6037328839302063
https://thesmartinvestor.com.sg/5-singapore-reits-with-strong-sponsors-and-gearing-levels-below-40/,5 Singapore REITs with Strong Sponsors and Gearing Levels Below 40%,"When it comes to the REIT sector, it's important to select REITs with strong attributes. The current environment of higher interest rates...",2024-08-14,The Smart Investor,positive,0.7012130618095398
https://www.tipranks.com/news/company-announcements/parkway-life-reit-reports-2024-earnings-with-strategic-expansion,Parkway Life REIT Reports 2024 Earnings with Strategic Expansion,Parkway Life Real Estate Investment Trust ( ($PRKWF) ) has released its Q4 earnings. Here is a breakdown of the information Parkway Life...,2025-02-26,TipRanks,neutral,0.6111010909080505
https://www.theedgesingapore.com/capital/reits/parkway-life-reits-french-acquisition-be-more-16-accretive-dpu,Parkway Life REIT’s French acquisition to be more than 1.6% accretive to DPU,"Parkway Life REIT is acquiring the portfolio at a cap rate of 6.5%, which is 150 basis points (bps) higher than other opportunities it was...",2024-10-30,The Edge Singapore,neutral,0.7387104034423828
https://www.tipranks.com/news/company-announcements/parkway-life-reit-announces-distribution-for-2024-period,Parkway Life REIT Announces Distribution for 2024 Period,"Parkway Life Real Estate Investment Trust has declared a distribution of 2.38 cents per unit for the period from November 1, 2024, to December...",2025-02-19,TipRanks,neutral,0.9425501823425293
https://thesmartinvestor.com.sg/year-in-review-4-singapore-reits-that-raised-their-dpu-in-2024/,Year-in-Review: 4 Singapore REITs That Raised Their DPU in 2024,"It has been a challenging year for REITs, but these four managed to up their DPU despite the headwinds.",2024-12-16,The Smart Investor,neutral,0.6693415641784668
https://www.theedgesingapore.com/capital/brokers-calls/brokers-digest-clar-cict-cnmc-goldmine-kore-wilmar-parkway-life-reit-flct-st,"Brokers’ Digest: CLAR, CICT, CNMC Goldmine, KORE, Wilmar, Parkway Life REIT, FLCT, ST Engineering","Overall, CLAR is one of Natarajan's top industrial Singapore REIT (S-REIT) picks, given its focus on asset development, redevelopments and enhancements.",2025-02-19,The Edge Singapore,neutral,0.9472333788871765
https://sbr.com.sg/commercial-property/news/parkway-life-reit-acquire-11-nursing-homes-in-europe-1599m,Parkway Life REIT to acquire 11 nursing homes in Europe for $159.9m,Parkway Life REIT to acquire 11 nursing homes in Europe for $159.9m. The REIT expects to complete the acquisition by Q4 2024. Parkway Life REIT...,2024-10-23,Singapore Business Review,neutral,0.8976794481277466
https://thesmartinvestor.com.sg/3-singapore-reits-that-raised-their-dpus-2/,3 Singapore REITs That Raised Their DPUs,"It may have been a tough two years for the REIT sector, but income investors are finally seeing some light at the end of the tunnel.",2024-11-04,The Smart Investor,positive,0.6044370532035828
https://thesmartinvestor.com.sg/smart-look-at-the-week-ahead-tesla-alphabet-us-inflation-parkwaylife-reit-and-capitaland-ascott-trust/,"Smart Look At The Week Ahead: Tesla, Alphabet, US Inflation, ParkwayLife REIT and CapitaLand Ascott Trust",It could be make or break time for US interest rates next week when the Federal Reserve's preferred inflation gauge is released on Friday.,2024-07-20,The Smart Investor,neutral,0.9310968518257141
https://thesmartinvestor.com.sg/4-singapore-reits-to-watch-out-for-in-august/,4 Singapore REITs to Watch Out for in August,"The REIT sector may have taken a beating in the past two years, but there may be a glimmer of hope on the horizon.",2024-07-31,The Smart Investor,neutral,0.7682541012763977
https://thesmartinvestor.com.sg/3-singapore-reits-i-plan-to-buy-when-the-market-crashes/,3 Singapore REITs I Plan to Buy When the Market Crashes,"Parkway Life REIT, or PLife REIT, is a healthcare REIT with a portfolio of 63 properties with assets under management (AUM) of S$2.2 billion.",2024-07-22,The Smart Investor,neutral,0.9231898784637451
https://www.theedgesingapore.com/capital/brokers-calls/brokers-digest-cdl-propnex-plife-reit-kit-singpost-grand-banks-yachts-nio,"Brokers’ Digest: CDL, PropNex, PLife REIT, KIT, SingPost, Grand Banks Yachts, Nio, Frencken, ST Engineering, UOB","According to KIT, the acquisition will be funded by internal sources and existing debt facilities, nudging net gearing up by 0.4 percentage...",2024-11-28,The Edge Singapore,neutral,0.950333833694458
https://thesmartinvestor.com.sg/5-singapore-reits-with-share-prices-hitting-their-52-week-highs-are-they-a-buy/,5 Singapore REITs with Share Prices Hitting Their 52-Week Highs: Are They a Buy?,The REIT sector is enjoying a strong rebound as interest rates look poised to fall. Here are five REITs that hit their 52-week high that you...,2024-09-11,The Smart Investor,neutral,0.7311804294586182
https://theindependent.sg/4-singapore-reits-that-could-unlock-a-lifetime-of-passive-income-are-you-ready-to-cash-in/,4 Singapore REITs that could unlock a lifetime of passive income—Are you ready to cash in?,"SINGAPORE: The Real Estate Investment Trust (REIT) sector has weathered its share of challenges over the past few years, grappling with rising interest...",2025-02-19,The Independent Singapore News,neutral,0.8182772994041443
https://thesmartinvestor.com.sg/unlock-your-future-income-3-top-singapore-reits-to-consider-now/,Unlock Your Future Income: 3 Top Singapore REITs to Consider Now,"Frasers Centrepoint Trust (SGX: J69U), Mapletree Pan Asia Commercial Trust (SGX: N2IU), and ParkwayLife REIT (SGX: C2PU) have all shown commendable performance.",2024-07-08,The Smart Investor,neutral,0.8819063901901245
https://thesmartinvestor.com.sg/5-singapore-reits-smashing-through-their-52-week-highs-can-their-rally-continue/,5 Singapore REITs Smashing Through Their 52-Week Highs: Can Their Rally Continue?,These five REITs have rallied strongly along with indications of continued interest rate cuts. Can they continue to do well?,2024-09-24,The Smart Investor,positive,0.7034412622451782
https://www.propertyeu.info/Nieuws/Parkway-Life-REIT-enters-Europe-with-111m-French-portfolio-deal/5af6ad96-d6cc-4a40-9475-d7f80dfd99f9,Parkway Life REIT enters Europe with €111m French portfolio deal,"Who are we? PropertyEU was established in 2006 as a truly pan-European information source for real estate professionals. We provide in-depth news, data and...",2024-10-24,IPE Real Assets,neutral,0.6854881644248962
https://www.businesstimes.com.sg/companies-markets/consumer-healthcare/siloam-international-hospitals-expresses-intent-acquire-first-reits-indonesia-hospital-portfolio,Siloam International Hospitals expresses intent to acquire First Reit’s Indonesia hospital portfolio,THE manager of First Real Estate Investment Trust (Reit) said on Monday (Jan 13) that it received a preliminary non-binding letter of intent...,2025-01-13,The Business Times,neutral,0.9109967947006226
https://www.sgx.com/research-education/market-updates/20240701-reit-watch-healthcare-s-reits-stay-defensive-robust,REIT Watch - Healthcare S-Reits stay defensive with robust fundamentals,"The healthcare sector is often viewed as defensive with growth opportunities, supported by long-term demographic and socio-economic trends.",2024-07-01,Singapore Exchange (SGX),positive,0.9416861534118652
https://www.theedgesingapore.com/capital/brokers-calls/brokers-digest-sgx-uob-marco-polo-marine-pan-united-corp-food-empire-plife,"Brokers’ Digest: SGX, UOB, Marco Polo Marine, Pan-United Corp, Food Empire, PLife REIT, Wilmar","UOB Kay Hian (UOBKH) has kept its “hold” call and target price of $11.83 ahead of the Singapore Exchange 's (SGX) results for 1HFY2025 ended Dec 31, 2024.",2025-01-17,The Edge Singapore,neutral,0.9495029449462891
https://www.businesstimes.com.sg/companies-markets/brokers-take-dbs-cuts-target-parkway-life-reit-after-factoring-higher-capex,Brokers’ take: DBS cuts target for Parkway Life Reit after factoring in higher capex,"In a report released on Thursday (Mar 7), the research team lowered its target to S$4.50 from S$4.80 and maintained its “buy” recommendation.",2024-03-07,The Business Times,positive,0.520927369594574
https://www.theedgesingapore.com/capital/brokers-calls/s-reits-long-awaited-turning-point-says-ocbc-investment-research,"S-REITs at ‘long-awaited turning point’, says OCBC Investment Research","The team has named FLCT, MINT, CLAS, CLAR and PLife REIT as its top picks.",2024-08-26,The Edge Singapore,positive,0.7436917424201965
https://www.businesstimes.com.sg/companies-markets/healthcare-s-reits-stay-defensive-robust-fundamentals,Healthcare S-Reits stay defensive with robust fundamentals,"Parkway Life Reit and First Reit invest in income-producing, healthcare-related commercial properties in both Singapore and overseas markets.",2024-06-30,The Business Times,positive,0.92640620470047
https://sg.finance.yahoo.com/news/3-singapore-reits-raised-dividends-233000755.html,3 Singapore REITs That Raised Their Dividends,"This earnings season, we managed to tease out three Singapore REITs that managed to up their distributions despite the economic headwinds.",2024-08-04,Yahoo,neutral,0.6226418018341064
https://www.straitstimes.com/business/reits-with-data-centres-and-hospitals-among-upcoming-ipos-sgx,Reits with data centres and hospitals among upcoming IPOs: SGX,SINGAPORE - Singapore's real estate investment trusts (S-Reits) are poised for a resurgence even as the sector is set to grow with an...,2024-08-30,The Straits Times,neutral,0.9311396479606628
